{
  "id": "edu-numbers",
  "title": "Australian Higher Education Research Dashboard",
  "url": "https://pdparker.github.io/edu_numbers_australia/",
  "repo": "pdparker/edu_numbers_australia",
  "lastBuild": "2026-07-19",
  "dataSources": [
    {
      "name": "Dept of Education Higher Education Statistics",
      "url": "https://www.education.gov.au/higher-education-statistics",
      "vintage": "to 2024",
      "refreshed": "2026-03-01"
    },
    {
      "name": "HERD (ABS biennial survey)",
      "vintage": "1992-2022"
    }
  ],
  "notes": "HERD is biennial; research income data lag ~18 months."
}
